{
  "event_id": "4da2bada-25a6-4d73-83a1-adc75b62ca90",
  "event_type": "gate_decision",
  "occurred_at": "2026-04-20T23:14:35.503Z",
  "gate": "final_approval_gate",
  "work_item_id": {
    "project": "CLV",
    "id": "CLV-004"
  },
  "decision": "approve",
  "approver": {
    "kind": "human",
    "id": "local-user"
  }
}
