{
  "event_id": "ba66c609-24d2-4730-b0c1-8d4f8f231989",
  "event_type": "gate_decision",
  "occurred_at": "2026-04-27T17:38:07.514Z",
  "gate": "final_approval_gate",
  "work_item_id": {
    "project": "CLV",
    "id": "CLV-38"
  },
  "decision": "approve",
  "approver": {
    "kind": "human",
    "id": "local-user"
  }
}
