{
  "event_id": "06bd0d16-857c-47ed-819f-60bc2fdac662",
  "event_type": "gate_decision",
  "occurred_at": "2026-05-26T21:39:49.572Z",
  "gate": "task_batch_gate",
  "work_item_id": {
    "project": "CLV",
    "id": "CLV-100"
  },
  "decision": "approve",
  "approver": {
    "kind": "human",
    "id": "local-user"
  }
}
